titulo,url
"Obrar contra su intención","https://etso.es/informes/analisis-estilometrico-obrar-contra-su-intencion"
"Obras son amores","https://etso.es/informes/analisis-estilometrico-obras-son-amores"
"Obras son calidad","https://etso.es/informes/analisis-estilometrico-obras-son-calidad"
"Obstinado Sapricio y el revenido Nicéforo, El","https://etso.es/informes/analisis-estilometrico-el-obstinado-sapricio-y-el-revenido-niceforo"
"Ocasión hace al ladrón, La","https://etso.es/informes/analisis-estilometrico-la-ocasion-hace-al-ladron"
"Ocasión perdida, La","https://etso.es/informes/analisis-estilometrico-la-ocasion-perdida"
"Octava maravilla, La","https://etso.es/informes/analisis-estilometrico-la-octava-maravilla"
"Ofender con las finezas","https://etso.es/informes/analisis-estilometrico-ofender-con-las-finezas"
"Ofensa y la venganza en el retrato, La","https://etso.es/informes/analisis-estilometrico-la-ofensa-y-la-venganza-en-el-retrato"
"Ofensor de sí mismo, El","https://etso.es/informes/analisis-estilometrico-el-ofensor-de-si-mismo"
"Ojos del cielo, Los - Abogada de los ojos, Santa Lucía, La","https://etso.es/informes/analisis-estilometrico-los-ojos-del-cielo-la-abogada-de-los-ojos-santa-lucia"
"Olimpa y Vireno","https://etso.es/informes/analisis-estilometrico-olimpa-y-vireno"
"Olvidar para vivir","https://etso.es/informes/analisis-estilometrico-olvidar-para-vivir"
"Olvidar por querer bien","https://etso.es/informes/analisis-estilometrico-olvidar-por-querer-bien"
"Oponerse a las estrellas","https://etso.es/informes/analisis-estilometrico-oponerse-las-estrellas"
"Orden de Melquisedec, La","https://etso.es/informes/analisis-estilometrico-la-orden-de-melquisedec"
"Orden de Redención y Virgen de los Remedios, La","https://etso.es/informes/analisis-estilometrico-la-orden-de-redencion-y-virgen-de-los-remedios"
"Órdenes militares, Las","https://etso.es/informes/analisis-estilometrico-las-ordenes-militares"
"Origen de nuestra señora de las Angustias, El","https://etso.es/informes/analisis-estilometrico-el-origen-de-nuestra-senora-de-las-angustias"
"Origen del bien y el mal y trabajos de Adán y Eva","https://etso.es/informes/analisis-estilometrico-origen-del-bien-y-el-mal-y-trabajos-de-adan-y-eva"
"Origen, pérdida y restauración de la Virgen del Sagrario - Tres edades de España, Las","https://etso.es/informes/analisis-estilometrico-las-tres-edades-de-espana-origen-perdida-y-restauracion-de-la"
"Osar morir da la vida","https://etso.es/informes/analisis-estilometrico-osar-morir-da-la-vida"
"Oveja perdida, La","https://etso.es/informes/analisis-estilometrico-la-oveja-perdida"
"Paces de los reyes y judía de Toledo, Las","https://etso.es/informes/analisis-estilometrico-las-paces-de-los-reyes-y-judia-de-toledo"
"Pachecos y Palomeques","https://etso.es/informes/analisis-estilometrico-pachecos-y-palomeques"
"Paciencia de Job, La","https://etso.es/informes/analisis-estilometrico-la-paciencia-de-job"
"Paciencia en la fortuna, La","https://etso.es/informes/analisis-estilometrico-la-paciencia-en-la-fortuna"
"Padre de su enemigo, El","https://etso.es/informes/analisis-estilometrico-el-padre-de-su-enemigo"
"Padrino de su afrenta, El","https://etso.es/informes/analisis-estilometrico-el-padrino-de-su-afrenta"
"Padrino desposado, El","https://etso.es/informes/analisis-estilometrico-el-padrino-desposado"
"Paga del mundo Representóle Antonio de Prado, La","https://etso.es/informes/analisis-estilometrico-la-paga-del-mundo-representole-antonio-de-prado"
"Pagar en propia moneda","https://etso.es/informes/analisis-estilometrico-pagar-en-propia-moneda"
"Pagarse en la misma flor y boda entre dos maridos","https://etso.es/informes/analisis-estilometrico-pagarse-en-la-misma-flor-y-boda-entre-dos-maridos"
"Paje de don Álvaro, El","https://etso.es/informes/analisis-estilometrico-el-paje-de-don-alvaro"
"Palabra vengada, La","https://etso.es/informes/analisis-estilometrico-la-palabra-vengada"
"Palabras a los reyes, Las","https://etso.es/informes/analisis-estilometrico-las-palabras-los-reyes"
"Palabras y plumas","https://etso.es/informes/analisis-estilometrico-palabras-y-plumas"
"Palacio confuso, El","https://etso.es/informes/analisis-estilometrico-el-palacio-confuso"
"Palacios de Galiana, Los","https://etso.es/informes/analisis-estilometrico-los-palacios-de-galiana"
"Palmerín de Oliva","https://etso.es/informes/analisis-estilometrico-palmerin-de-oliva"
"Paloma de Toledo, La","https://etso.es/informes/analisis-estilometrico-la-paloma-de-toledo"
"Pan de Vallecas, El","https://etso.es/informes/analisis-estilometrico-el-pan-de-vallecas"
"Para conquistar desprecios, más pueden celos que amor","https://etso.es/informes/analisis-estilometrico-para-conquistar-desprecios-mas-pueden-celos-que-amor"
"Para vencer a amor, querer vencerle","https://etso.es/informes/analisis-estilometrico-para-vencer-amor-querer-vencerle"
"Paraíso de Laura, El","https://etso.es/informes/analisis-estilometrico-el-paraiso-de-laura"
"Parecido, El (Refundición posterior)","https://etso.es/informes/analisis-estilometrico-el-parecido"
"Paredes oyen, Las","https://etso.es/informes/analisis-estilometrico-las-paredes-oyen"
"Pasión","https://etso.es/informes/analisis-estilometrico-pasion"
"Pasión vencida de afecto","https://etso.es/informes/analisis-estilometrico-pasion-vencida-de-afecto"
"Pastelero de Madrigal, rey don Sebastián fingido, El","https://etso.es/informes/analisis-estilometrico-el-pastelero-de-madrigal-rey-don-sebastian-fingido"
"Pastor Fido, El","https://etso.es/informes/analisis-estilometrico-el-pastor-fido"
"Pastor Fido, El","https://etso.es/informes/analisis-estilometrico-el-pastor-fido-0"
"Pastor lobo y cabaña celestial","https://etso.es/informes/analisis-estilometrico-pastor-lobo-y-cabana-celestial"
"Pastor lobo y cabaña celestial, El","https://etso.es/informes/analisis-estilometrico-el-pastor-lobo-y-cabana-celestial"
"Pastora Alfea (Primera parte)","https://etso.es/informes/analisis-estilometrico-pastora-alfea-primera-parte"
"Pastora Alfea (Segunda parte)","https://etso.es/informes/analisis-estilometrico-pastora-alfea-segunda-parte"
"Pastoral de Jacinto, La","https://etso.es/informes/analisis-estilometrico-la-pastoral-de-jacinto"
"Pastores de Belen, Los","https://etso.es/informes/analisis-estilometrico-los-pastores-de-belen"
"Pastores de Belén, Los","https://etso.es/informes/analisis-estilometrico-los-pastores-de-belen-0"
"Patrón de Salamanca, El","https://etso.es/informes/analisis-estilometrico-el-patron-de-salamanca"
"Paz de Dios con el hombre, La","https://etso.es/informes/analisis-estilometrico-la-paz-de-dios-con-el-hombre"
"Pecador convertido en el ángel de la guarda, El","https://etso.es/informes/analisis-estilometrico-el-pecador-convertido-en-el-angel-de-la-guarda"
"Pechos privilegiados, Los","https://etso.es/informes/analisis-estilometrico-los-pechos-privilegiados"
"Pedidora, La","https://etso.es/informes/analisis-estilometrico-la-pedidora"
"Pedir favor al contrario","https://etso.es/informes/analisis-estilometrico-pedir-favor-al-contrario"
"Pedir justicia al culpado","https://etso.es/informes/analisis-estilometrico-pedir-justicia-al-culpado"
"Pedro Carbonero","https://etso.es/informes/analisis-estilometrico-pedro-carbonero"
"Pedro de Urdemalas","https://etso.es/informes/analisis-estilometrico-pedro-de-urdemalas"
"Pedro de Urdemalas","https://etso.es/informes/analisis-estilometrico-pedro-de-urdemalas-0"
"Pedro de Urdemalas","https://etso.es/informes/analisis-estilometrico-pedro-de-urdemalas-1"
"Pedro Telonario","https://etso.es/informes/analisis-estilometrico-pedro-telonario"
"Pelear hasta morir","https://etso.es/informes/analisis-estilometrico-pelear-hasta-morir"
"Peligrar en los remedios","https://etso.es/informes/analisis-estilometrico-peligrar-en-los-remedios"
"Peligro de la sangre y remedio en el acaso, El","https://etso.es/informes/analisis-estilometrico-el-peligro-de-la-sangre-y-remedio-en-el-acaso"
"Peligro en la amistad, El","https://etso.es/informes/analisis-estilometrico-el-peligro-en-la-amistad"
"Peligro en mar, y tierra, El","https://etso.es/informes/analisis-estilometrico-el-peligro-en-mar-y-tierra"
"Peligros de la ausencia, Los","https://etso.es/informes/analisis-estilometrico-los-peligros-de-la-ausencia"
"Peña de Francia, La","https://etso.es/informes/analisis-estilometrico-la-pena-de-francia"
"Peor es hurgallo","https://etso.es/informes/analisis-estilometrico-peor-es-hurgallo"
"Peor está que estaba","https://etso.es/informes/analisis-estilometrico-peor-esta-que-estaba"
"Perder para tener","https://etso.es/informes/analisis-estilometrico-perder-para-tener"
"Perderse por no perderse","https://etso.es/informes/analisis-estilometrico-perderse-por-no-perderse"
"Pérdida de España, La","https://etso.es/informes/analisis-estilometrico-la-perdida-de-espana"
"Pérdida honrosa, La","https://etso.es/informes/analisis-estilometrico-la-perdida-honrosa"
"Pérdida y restauración de la Bahía de Todos Santos","https://etso.es/informes/analisis-estilometrico-perdida-y-restauracion-de-la-bahia-de-todos-santos"
"Perdón castiga más, El","https://etso.es/informes/analisis-estilometrico-el-perdon-castiga-mas"
"Perdonar por no poderse vengar","https://etso.es/informes/analisis-estilometrico-perdonar-no-poderse-vengar"
"Peregrina del cielo, La","https://etso.es/informes/analisis-estilometrico-la-peregrina-del-cielo"
"Perfección es el desdén","https://etso.es/informes/analisis-estilometrico-perfeccion-es-el-desden"
"Perfecta casada, La - Prudente, sabia y honrada","https://etso.es/informes/analisis-estilometrico-la-perfecta-casada-prudente-sabia-y-honrada"
"Perfecto caballero, El","https://etso.es/informes/analisis-estilometrico-el-perfecto-caballero"
"Peribáñez y el comendador de Ocaña","https://etso.es/informes/analisis-estilometrico-peribanez-y-el-comendador-de-ocana"
"Perico de Utrera, El (Tercera jornada)","https://etso.es/informes/analisis-estilometrico-el-perico-de-utrera-tercera-jornada"
"Perico el de los palotes","https://etso.es/informes/analisis-estilometrico-perico-el-de-los-palotes"
"Perla asombro del mar en la merced de su aurora o Vida y muerte de Santa María de Cervellón y Socos, La","https://etso.es/informes/analisis-estilometrico-la-perla-asombro-del-mar-en-la-merced-de-su-aurora-o-vida-y-muerte"
"Perla de Inglaterra y peregrina de Hungría, La","https://etso.es/informes/analisis-estilometrico-la-perla-de-inglaterra-y-peregrina-de-hungria"
"Perla del sacramento, La","https://etso.es/informes/analisis-estilometrico-la-perla-del-sacramento"
"Perro del hortelano, El - Condesa de Belflor, La","https://etso.es/informes/analisis-estilometrico-el-perro-del-hortelano-la-condesa-de-belflor"
"Perseguida Amaltea, La","https://etso.es/informes/analisis-estilometrico-la-perseguida-amaltea"
"Perseguido, El","https://etso.es/informes/analisis-estilometrico-el-perseguido"
"Persiles y Sigismunda","https://etso.es/informes/analisis-estilometrico-persiles-y-sigismunda"
"Piadoso aragonés, El","https://etso.es/informes/analisis-estilometrico-el-piadoso-aragones"
"Piadoso veneciano, El","https://etso.es/informes/analisis-estilometrico-el-piadoso-veneciano"
"Picarillo en España, El","https://etso.es/informes/analisis-estilometrico-el-picarillo-en-espana"
"Piedad ejecutada, La","https://etso.es/informes/analisis-estilometrico-la-piedad-ejecutada"
"Piedad en la Justicia, La","https://etso.es/informes/analisis-estilometrico-la-piedad-en-la-justicia"
"Piedra filosofal, La","https://etso.es/informes/analisis-estilometrico-la-piedra-filosofal"
"Piel de Gedeón, La","https://etso.es/informes/analisis-estilometrico-la-piel-de-gedeon"
"Pintor de su deshonra, El","https://etso.es/informes/analisis-estilometrico-el-pintor-de-su-deshonra"
"Píramo y Tisbe","https://etso.es/informes/analisis-estilometrico-piramo-y-tisbe"
"Planetas, Los","https://etso.es/informes/analisis-estilometrico-los-planetas"
"Platera, La","https://etso.es/informes/analisis-estilometrico-la-platera"
"Platero del cielo, El","https://etso.es/informes/analisis-estilometrico-el-platero-del-cielo"
"Plato de Génova, El","https://etso.es/informes/analisis-estilometrico-el-plato-de-genova"
"Playa de Sanlúcar","https://etso.es/informes/analisis-estilometrico-playa-de-sanlucar"
"Plazuela de Santa Cruz, La","https://etso.es/informes/analisis-estilometrico-la-plazuela-de-santa-cruz"
"Pleito de Hernán Cortés con Pánfilo de Narvaez, El","https://etso.es/informes/analisis-estilometrico-el-pleito-de-hernan-cortes-con-panfilo-de-narvaez"
"Pleito del demonio con la Virgen, El","https://etso.es/informes/analisis-estilometrico-el-pleito-del-demonio-con-la-virgen"
"Pleito matrimonial, El","https://etso.es/informes/analisis-estilometrico-el-pleito-matrimonial"
"Pleito por la honra, El - Valor de Fernandito, El","https://etso.es/informes/analisis-estilometrico-el-pleito-por-la-honra-el-valor-de-fernandito"
"Pleito que tuvo el diablo con el cura de Madridejos, El","https://etso.es/informes/analisis-estilometrico-el-pleito-que-tuvo-el-diablo-con-el-cura-de-madridejos"
"Pleitos de Hernán Cortés, Los","https://etso.es/informes/analisis-estilometrico-los-pleitos-de-hernan-cortes"
"Pleitos de Inglaterra, Los","https://etso.es/informes/analisis-estilometrico-los-pleitos-de-inglaterra"
"Pluma, púrpura, y espada, solo en Cisneros se halla, y restauración de Orán","https://etso.es/informes/analisis-estilometrico-pluma-purpura-y-espada-solo-en-cisneros-se-halla-y-restauracion-de"
"Pobre honrado, El","https://etso.es/informes/analisis-estilometrico-el-pobre-honrado"
"Pobre más poderoso San Juan de Dios, El","https://etso.es/informes/analisis-estilometrico-el-pobre-mas-poderoso-san-juan-de-dios"
"Pobreza estimada, La","https://etso.es/informes/analisis-estilometrico-la-pobreza-estimada"
"Pobreza no es vileza","https://etso.es/informes/analisis-estilometrico-pobreza-no-es-vileza"
"Pobreza, amor y fortuna","https://etso.es/informes/analisis-estilometrico-pobreza-amor-y-fortuna"
"Pobrezas de Reinaldos, Las","https://etso.es/informes/analisis-estilometrico-las-pobrezas-de-reinaldos"
"Poco aprovechan avisos cuando hay mala inclinación","https://etso.es/informes/analisis-estilometrico-poco-aprovechan-avisos-cuando-hay-mala-inclinacion"
"Pocos bastan si son buenos y el crisol de la lealtad","https://etso.es/informes/analisis-estilometrico-pocos-bastan-si-son-buenos-y-el-crisol-de-la-lealtad"
"Poder de la amistad, El","https://etso.es/informes/analisis-estilometrico-el-poder-de-la-amistad"
"Poder en el discreto, El","https://etso.es/informes/analisis-estilometrico-el-poder-en-el-discreto"
"Poder vencido y amor premiado, El","https://etso.es/informes/analisis-estilometrico-el-poder-vencido-y-amor-premiado"
"Poder y amor compitiendo","https://etso.es/informes/analisis-estilometrico-poder-y-amor-compitiendo"
"Polifemo y Circe","https://etso.es/informes/analisis-estilometrico-polifemo-y-circe"
"Polifemo, El","https://etso.es/informes/analisis-estilometrico-el-polifemo"
"Poncella de Orleans, La","https://etso.es/informes/analisis-estilometrico-la-poncella-de-orleans"
"Ponces de Barcelona, Los","https://etso.es/informes/analisis-estilometrico-los-ponces-de-barcelona"
"Ponerse hábito sin pruebas y guapo Julián Romero","https://etso.es/informes/analisis-estilometrico-ponerse-habito-sin-pruebas-y-guapo-julian-romero"
"Póngale nombre el discreto","https://etso.es/informes/analisis-estilometrico-pongale-nombre-el-discreto"
"Por acrisolar su honor, competidor hijo, y padre","https://etso.es/informes/analisis-estilometrico-por-acrisolar-su-honor-competidor-hijo-y-padre"
"Por el sótano y el torno","https://etso.es/informes/analisis-estilometrico-por-el-sotano-y-el-torno"
"Por la puente, Juana","https://etso.es/informes/analisis-estilometrico-por-la-puente-juana"
"Por oir misa y dar cebada nunca se perdió jornada","https://etso.es/informes/analisis-estilometrico-por-oir-misa-y-dar-cebada-nunca-se-perdio-jornada"
"Por su rey y por su dama","https://etso.es/informes/analisis-estilometrico-por-su-rey-y-por-su-dama"
"Porceles de Murcia, Los","https://etso.es/informes/analisis-estilometrico-los-porceles-de-murcia"
"Porcia y Tancredo","https://etso.es/informes/analisis-estilometrico-porcia-y-tancredo"
"Porfiando vence amor","https://etso.es/informes/analisis-estilometrico-porfiando-vence-amor"
"Porfiar hasta morir","https://etso.es/informes/analisis-estilometrico-porfiar-hasta-morir"
"Portuguesa y dicha del forastero, La","https://etso.es/informes/analisis-estilometrico-la-portuguesa-y-dicha-del-forastero"
"Postrer duelo de España, El","https://etso.es/informes/analisis-estilometrico-el-postrer-duelo-de-espana"
"Postrer godo de España, El","https://etso.es/informes/analisis-estilometrico-el-postrer-godo-de-espana"
"Prabos, Soldado, Pascual y Antona","https://etso.es/informes/analisis-estilometrico-prabos-soldado-pascual-y-antona"
"Prado de Valencia, El","https://etso.es/informes/analisis-estilometrico-el-prado-de-valencia"
"Prados de León, Los","https://etso.es/informes/analisis-estilometrico-los-prados-de-leon"
"Premiar al liberal por rescatar su fortuna, El","https://etso.es/informes/analisis-estilometrico-el-premiar-al-liberal-por-rescatar-su-fortuna"
"Premiar por solo saber","https://etso.es/informes/analisis-estilometrico-premiar-por-solo-saber"
"Premio de la hermosura, El","https://etso.es/informes/analisis-estilometrico-el-premio-de-la-hermosura"
"Premio de la humildad y daños de la soberbia, El","https://etso.es/informes/analisis-estilometrico-el-premio-de-la-humildad-y-danos-de-la-soberbia"
"Premio de la limosna, El","https://etso.es/informes/analisis-estilometrico-el-premio-de-la-limosna"
"Premio de la virtud, El","https://etso.es/informes/analisis-estilometrico-el-premio-de-la-virtud"
"Premio de la virtud, El","https://etso.es/informes/analisis-estilometrico-el-premio-de-la-virtud-y-sucesos-prodigiosos-de-don-pedro-guerrero"
"Premio de las letras por el rey Felipe II, El","https://etso.es/informes/analisis-estilometrico-el-premio-de-las-letras-por-el-rey-felipe-ii"
"Premio del bien hablar, El","https://etso.es/informes/analisis-estilometrico-el-premio-del-bien-hablar"
"Premio en la tiranía, El","https://etso.es/informes/analisis-estilometrico-el-premio-en-la-tirania"
"Premio riguroso y amistad bien pagada, El","https://etso.es/informes/analisis-estilometrico-el-premio-riguroso-y-amistad-bien-pagada"
"Preso, muerto y vencedor, todos cumplen con su honor en defensa de Cremona","https://etso.es/informes/analisis-estilometrico-preso-muerto-y-vencedor-todos-cumplen-con-su-honor-en-defensa-de"
"Presumida y la hermosa, La","https://etso.es/informes/analisis-estilometrico-la-presumida-y-la-hermosa"
"Pretender con pobreza, El","https://etso.es/informes/analisis-estilometrico-el-pretender-con-pobreza"
"Pretendiente al revés, El","https://etso.es/informes/analisis-estilometrico-el-pretendiente-al-reves"
"Pretensor de su madre, El","https://etso.es/informes/analisis-estilometrico-el-pretensor-de-su-madre"
"Primer blasón de Austria, El","https://etso.es/informes/analisis-estilometrico-el-primer-blason-de-austria"
"Primer conde de Flandes, El","https://etso.es/informes/analisis-estilometrico-el-primer-conde-de-flandes"
"Primer condenado, El","https://etso.es/informes/analisis-estilometrico-el-primer-condenado"
"Primer duelo del mundo, El","https://etso.es/informes/analisis-estilometrico-el-primer-duelo-del-mundo"
"Primer Fajardo, El","https://etso.es/informes/analisis-estilometrico-el-primer-fajardo"
"Primer flor del Carmelo, La","https://etso.es/informes/analisis-estilometrico-la-primer-flor-del-carmelo"
"Primer marqués de Astorga, El","https://etso.es/informes/analisis-estilometrico-el-primer-marques-de-astorga"
"Primer refugio del hombre y probática piscina, El","https://etso.es/informes/analisis-estilometrico-el-primer-refugio-del-hombre-y-probatica-piscina"
"Primer rey de Castilla, El","https://etso.es/informes/analisis-estilometrico-el-primer-rey-de-castilla"
"Primer sol de Toledo, El","https://etso.es/informes/analisis-estilometrico-el-primer-sol-de-toledo"
"Primer Templo de Amor, El","https://etso.es/informes/analisis-estilometrico-el-primer-templo-de-amor"
"Primer templo de Cristo, El","https://etso.es/informes/analisis-estilometrico-el-primer-templo-de-cristo"
"Primer templo de España y San Segundo Obispo de Ávila, El","https://etso.es/informes/analisis-estilometrico-primer-templo-de-espana-y-san-segundo-obispo-de-avila-el"
"Primera información, La","https://etso.es/informes/analisis-estilometrico-la-primera-informacion"
"Primera redención","https://etso.es/informes/analisis-estilometrico-primera-redencion"
"Primero al rey que al honor","https://etso.es/informes/analisis-estilometrico-primero-al-rey-que-al-honor"
"Primero es la honra","https://etso.es/informes/analisis-estilometrico-primero-es-la-honra"
"Primero es la honra que el gusto","https://etso.es/informes/analisis-estilometrico-primero-es-la-honra-que-el-gusto"
"Primero rey del mundo, El","https://etso.es/informes/analisis-estilometrico-el-primero-rey-del-mundo"
"Primero soy yo","https://etso.es/informes/analisis-estilometrico-primero-soy-yo"
"Primero y segundo Isaac","https://etso.es/informes/analisis-estilometrico-primero-y-segundo-isaac"
"Princesa de Toledo y estrella de la Bureba, Santa Casilda, La","https://etso.es/informes/analisis-estilometrico-la-princesa-de-toledo-y-estrella-de-la-bureba-santa-casilda"
"Príncipe constante, El","https://etso.es/informes/analisis-estilometrico-el-principe-constante"
"Príncipe de la banda, El","https://etso.es/informes/analisis-estilometrico-el-principe-de-la-banda"
"Príncipe de la estrella y castillo de la vida, El","https://etso.es/informes/analisis-estilometrico-el-principe-de-la-estrella-y-castillo-de-la-vida"
"Príncipe de la Paz, El","https://etso.es/informes/analisis-estilometrico-el-principe-de-la-paz"
"Príncipe del desierto y ermitaño de palacio, El","https://etso.es/informes/analisis-estilometrico-el-principe-del-desierto-y-ermitano-de-palacio"
"Príncipe despeñado, El","https://etso.es/informes/analisis-estilometrico-el-principe-despenado"
"Príncipe don Carlos, El","https://etso.es/informes/analisis-estilometrico-el-principe-don-carlos"
"Príncipe esclavo, El (Primera parte)","https://etso.es/informes/analisis-estilometrico-el-principe-esclavo-primera-parte"
"Príncipe esclavo, El (Segunda parte)","https://etso.es/informes/analisis-estilometrico-el-principe-esclavo-segunda-parte"
"Príncipe inocente, El","https://etso.es/informes/analisis-estilometrico-el-principe-inocente"
"Príncipe jardinero y fingido Cloridano, El","https://etso.es/informes/analisis-estilometrico-el-principe-jardinero-y-fingido-cloridano"
"Príncipe melancólico, El","https://etso.es/informes/analisis-estilometrico-el-principe-melancolico"
"Príncipe peregrino, y prodigio en Dinamarca, El","https://etso.es/informes/analisis-estilometrico-el-principe-peregrino-y-prodigio-en-dinamarca"
"Príncipe perfecto, El (Primera parte)","https://etso.es/informes/analisis-estilometrico-el-principe-perfecto-primera-parte"
"Príncipe perfecto, El (Segunda parte)","https://etso.es/informes/analisis-estilometrico-el-principe-perfecto-segunda-parte"
"Príncipe perseguido, El","https://etso.es/informes/analisis-estilometrico-el-principe-perseguido"
"Príncipe perseguido, El","https://etso.es/informes/analisis-estilometrico-el-principe-perseguido-0"
"Príncipe prodigioso, El","https://etso.es/informes/analisis-estilometrico-el-principe-prodigioso"
"Príncipe tirano, El","https://etso.es/informes/analisis-estilometrico-el-principe-tirano"
"Príncipe tirano, El (Otra versión)","https://etso.es/informes/analisis-estilometrico-el-principe-tirano-otra-version"
"Príncipe villano, El","https://etso.es/informes/analisis-estilometrico-el-principe-villano"
"Príncipe viñador, El","https://etso.es/informes/analisis-estilometrico-el-principe-vinador"
"Príncipes de la Iglesia, Los","https://etso.es/informes/analisis-estilometrico-los-principes-de-la-iglesia"
"Príncipes de Tesalia, Los","https://etso.es/informes/analisis-estilometrico-los-principes-de-tesalia"
"Principio de la Inquisición, El","https://etso.es/informes/analisis-estilometrico-el-principio-de-la-inquisicion"
"Prisión sin culpa, La","https://etso.es/informes/analisis-estilometrico-la-prision-sin-culpa"
"Prisiones de Adán, Las","https://etso.es/informes/analisis-estilometrico-las-prisiones-de-adan"
"Privanza del hombre, La","https://etso.es/informes/analisis-estilometrico-la-privanza-del-hombre"
"Privanza desleal y voluntad por la fama, La","https://etso.es/informes/analisis-estilometrico-la-privanza-desleal-y-voluntad-por-la-fama"
"Privanza y caída de don Álvaro de Luna, La","https://etso.es/informes/analisis-estilometrico-la-privanza-y-caida-de-don-alvaro-de-luna"
"Privar contra su gusto","https://etso.es/informes/analisis-estilometrico-privar-contra-su-gusto"
"Privilegios de las mujeres, Los","https://etso.es/informes/analisis-estilometrico-los-privilegios-de-las-mujeres"
"Prodigio de Alemania, El","https://etso.es/informes/analisis-estilometrico-el-prodigio-de-alemania"
"Prodigio de los montes y mártir del cielo (Santa Bárbara), El - Bárbara de los montes, La","https://etso.es/informes/analisis-estilometrico-la-barbara-de-los-montes-el-prodigio-de-los-montes"
"Prodigio de Polonia, El","https://etso.es/informes/analisis-estilometrico-el-prodigio-de-polonia"
"Prodigio de Viterbo y emperador más tirano","https://etso.es/informes/analisis-estilometrico-prodigio-de-viterbo-y-emperador-mas-tirano"
"Prodigios de amor","https://etso.es/informes/analisis-estilometrico-prodigios-de-amor"
"Prodigios de la vara y el capitán de Israel","https://etso.es/informes/analisis-estilometrico-prodigios-de-la-vara-y-el-capitan-de-israel"
"Prodigioso príncipe transilvano, El","https://etso.es/informes/analisis-estilometrico-el-prodigioso-principe-transilvano"
