titulo,url
"Loa inscrita en las Reales fiestas a la Virgen de los Desamparados","https://etso.es/informes/analisis-estilometrico-loa-inscrita-en-las-reales-fiestas-la-virgen-de-los-desamparados"
"Loa sacramental de los siete planetas","https://etso.es/informes/analisis-estilometrico-loa-sacramental-de-los-siete-planetas"
"Loca, cuerda, enamorada, y acertar donde hay error","https://etso.es/informes/analisis-estilometrico-loca-cuerda-enamorada-y-acertar-donde-hay-error"
"Loco cuerdo, El","https://etso.es/informes/analisis-estilometrico-el-loco-cuerdo"
"Loco del desierto, El","https://etso.es/informes/analisis-estilometrico-el-loco-del-desierto"
"Loco en la penitencia y tirano más impropio, El","https://etso.es/informes/analisis-estilometrico-el-loco-en-la-penitencia-y-tirano-mas-impropio"
"Loco por fuerza, El","https://etso.es/informes/analisis-estilometrico-el-loco-por-fuerza"
"Locos de Valencia, Los","https://etso.es/informes/analisis-estilometrico-los-locos-de-valencia"
"Locos por el cielo, Los","https://etso.es/informes/analisis-estilometrico-los-locos-por-el-cielo"
"Locura cuerda, La","https://etso.es/informes/analisis-estilometrico-la-locura-cuerda"
"Locura por el alma, La","https://etso.es/informes/analisis-estilometrico-la-locura-por-el-alma"
"Locura por la honra, La","https://etso.es/informes/analisis-estilometrico-la-locura-por-la-honra"
"Locura, La","https://etso.es/informes/analisis-estilometrico-la-locura"
"Locuras de Orlando, Las","https://etso.es/informes/analisis-estilometrico-las-locuras-de-orlando"
"Locuras y amores del príncipe Fisberto, Las","https://etso.es/informes/analisis-estilometrico-las-locuras-y-amores-del-principe-fisberto"
"Lorenzo Hurtado en Madrid la segunda vez","https://etso.es/informes/analisis-estilometrico-lorenzo-hurtado-en-madrid-la-segunda-vez"
"Lorenzo me llamo","https://etso.es/informes/analisis-estilometrico-lorenzo-me-llamo"
"Lucero de Castilla y privado perseguido, El","https://etso.es/informes/analisis-estilometrico-el-lucero-de-castilla-y-privado-perseguido"
"Lucero de Madrid, El","https://etso.es/informes/analisis-estilometrico-el-lucero-de-madrid"
"Lucero de Madrid, y Divino labrador San Isidro, El","https://etso.es/informes/analisis-estilometrico-el-lucero-de-madrid-y-divino-labrador-san-isidro"
"Lucero del sol, San Juan Bautista, El","https://etso.es/informes/analisis-estilometrico-el-lucero-del-sol-san-juan-bautista"
"Lucero eclipsado, El","https://etso.es/informes/analisis-estilometrico-el-lucero-eclipsado"
"Lucero serafín, El","https://etso.es/informes/analisis-estilometrico-el-lucero-serafin"
"Lucidoro aragonés (Tercera jornada)","https://etso.es/informes/analisis-estilometrico-lucidoro-aragones-tercera-jornada"
"Lucinda perseguida","https://etso.es/informes/analisis-estilometrico-lucinda-perseguida"
"Lucinda y Belardo","https://etso.es/informes/analisis-estilometrico-lucinda-y-belardo"
"Lucir con ajena estrella","https://etso.es/informes/analisis-estilometrico-lucir-con-ajena-estrella"
"Lucistela","https://etso.es/informes/analisis-estilometrico-lucistela"
"Lucrecia y Tarquino","https://etso.es/informes/analisis-estilometrico-lucrecia-y-tarquino"
"Ludovico el Piadoso","https://etso.es/informes/analisis-estilometrico-ludovico-el-piadoso"
"Luis Pérez el gallego","https://etso.es/informes/analisis-estilometrico-luis-perez-el-gallego"
"Luis Pérez el Gallego (Segunda parte)","https://etso.es/informes/analisis-estilometrico-luis-perez-el-gallego-segunda-parte"
"Luna de Florencia, La","https://etso.es/informes/analisis-estilometrico-la-luna-de-florencia"
"Luna de la Sagra, La","https://etso.es/informes/analisis-estilometrico-la-luna-de-la-sagra"
"Luna de la sierra, La","https://etso.es/informes/analisis-estilometrico-la-luna-de-la-sierra"
"Luz del Sol de Oriente, San Ignacio en París, La","https://etso.es/informes/analisis-estilometrico-la-luz-del-sol-de-oriente-san-ignacio-en-paris"
"Madrastra más honrada, La","https://etso.es/informes/analisis-estilometrico-la-madrastra-mas-honrada"
"Madre de la mejor, La","https://etso.es/informes/analisis-estilometrico-la-madre-de-la-mejor"
"Madre Teresa de Jesús, La","https://etso.es/informes/analisis-estilometrico-la-madre-teresa-de-jesus"
"Madrina del cielo, La","https://etso.es/informes/analisis-estilometrico-la-madrina-del-cielo"
"Maestrazgo del Tusón, El","https://etso.es/informes/analisis-estilometrico-el-maestrazgo-del-tuson"
"Maestro de Alejandro, El","https://etso.es/informes/analisis-estilometrico-el-maestro-de-alejandro"
"Maestro de danzar, El","https://etso.es/informes/analisis-estilometrico-el-maestro-de-danzar"
"Maestro de danzar, El","https://etso.es/informes/analisis-estilometrico-el-maestro-de-danzar-0"
"Magdalena de Roma, La","https://etso.es/informes/analisis-estilometrico-la-magdalena-de-roma"
"Mágico mexicano, El","https://etso.es/informes/analisis-estilometrico-el-magico-mexicano"
"Mágico prodigioso, El","https://etso.es/informes/analisis-estilometrico-magico-prodigioso-el"
"Mago, El","https://etso.es/informes/analisis-estilometrico-el-mago"
"Mal inclinado","https://etso.es/informes/analisis-estilometrico-mal-inclinado"
"Mal pagador en pajas","https://etso.es/informes/analisis-estilometrico-el-mal-pagador-en-pajas"
"Mala inclinación, La","https://etso.es/informes/analisis-estilometrico-la-mala-inclinacion"
"Malcasada, La","https://etso.es/informes/analisis-estilometrico-la-malcasada"
"Malcasados de Valencia, Los","https://etso.es/informes/analisis-estilometrico-los-malcasados-de-valencia"
"Maldición contra sí, La","https://etso.es/informes/analisis-estilometrico-la-maldicion-contra-si"
"Maná del cielo, El","https://etso.es/informes/analisis-estilometrico-el-mana-del-cielo"
"Mañana será otro día","https://etso.es/informes/analisis-estilometrico-manana-sera-otro-dia"
"Mañanas de abril y mayo","https://etso.es/informes/analisis-estilometrico-mananas-de-abril-y-mayo"
"Manasés, rey de Judea","https://etso.es/informes/analisis-estilometrico-manases-rey-de-judea"
"Mancebo del camino, El","https://etso.es/informes/analisis-estilometrico-el-mancebo-del-camino"
"Mancebón de los palacios, El","https://etso.es/informes/analisis-estilometrico-el-mancebon-de-los-palacios"
"Manga de Sarracino, La","https://etso.es/informes/analisis-estilometrico-la-manga-de-sarracino"
"Manganilla de Melilla, La","https://etso.es/informes/analisis-estilometrico-la-manganilla-de-melilla"
"Manos blancas no ofenden, Las","https://etso.es/informes/analisis-estilometrico-manos-blancas-no-ofenden-las"
"Manos y cuajares, Las","https://etso.es/informes/analisis-estilometrico-las-manos-y-cuajares"
"Manzana de la discordia y robo de Helena","https://etso.es/informes/analisis-estilometrico-manzana-de-la-discordia-y-robo-de-helena"
"Maravillas de Babilonia, Las","https://etso.es/informes/analisis-estilometrico-las-maravillas-de-babilonia"
"Marco Antonio y Cleopatra","https://etso.es/informes/analisis-estilometrico-marco-antonio-y-cleopatra"
"Margarita del cielo, La","https://etso.es/informes/analisis-estilometrico-la-margarita-del-cielo"
"Margarita del Tajo que dio nombre a Santarén, La","https://etso.es/informes/analisis-estilometrico-la-margarita-del-tajo-que-dio-nombre-santaren"
"Margarita preciosa, La","https://etso.es/informes/analisis-estilometrico-la-margarita-preciosa"
"Margarita preciosa, La","https://etso.es/informes/analisis-estilometrico-la-margarita-preciosa-0"
"María del Socorro","https://etso.es/informes/analisis-estilometrico-maria-del-socorro"
"Marido asegurado, El","https://etso.es/informes/analisis-estilometrico-el-marido-asegurado"
"Marido de su hermana y mentirosa verdad, El","https://etso.es/informes/analisis-estilometrico-el-marido-de-su-hermana-y-mentirosa-verdad"
"Marido de su madre, El","https://etso.es/informes/analisis-estilometrico-el-marido-de-su-madre"
"Marido hace mujer y el trato muda costumbre, El","https://etso.es/informes/analisis-estilometrico-el-marido-hace-mujer-y-el-trato-muda-costumbre"
"Marido más firme, El","https://etso.es/informes/analisis-estilometrico-el-marido-mas-firme"
"Marina la porquera","https://etso.es/informes/analisis-estilometrico-marina-la-porquera"
"Mariscal de Virón, El","https://etso.es/informes/analisis-estilometrico-el-mariscal-de-viron"
"Mariscal de Virón, El (Burlesca)","https://etso.es/informes/analisis-estilometrico-el-mariscal-de-viron-burlesca"
"Mármol de Felisardo, El","https://etso.es/informes/analisis-estilometrico-el-marmol-de-felisardo"
"Marqués de las Navas, El","https://etso.es/informes/analisis-estilometrico-el-marques-de-las-navas"
"Marqués de Mantua, El","https://etso.es/informes/analisis-estilometrico-el-marques-de-mantua"
"Marqués del Basto, El","https://etso.es/informes/analisis-estilometrico-el-marques-del-basto"
"Marqués del cigarral, El","https://etso.es/informes/analisis-estilometrico-el-marques-del-cigarral"
"Marta la Piadosa","https://etso.es/informes/analisis-estilometrico-marta-la-piadosa"
"Marta la Romarantina (Primera parte)","https://etso.es/informes/analisis-estilometrico-marta-la-romarantina-primera-parte"
"Marta la Romarantina (Segunda parte)","https://etso.es/informes/analisis-estilometrico-marta-la-romarantina-segunda-parte"
"Marte español, Guzmán de Juan, El","https://etso.es/informes/analisis-estilometrico-el-marte-espanol-guzman-de-juan"
"Marte y Belona en Hungría","https://etso.es/informes/analisis-estilometrico-marte-y-belona-en-hungria"
"Martinillo, El (Primera parte)","https://etso.es/informes/analisis-estilometrico-el-martinillo-primera-parte"
"Martinillo, El (Segunda parte)","https://etso.es/informes/analisis-estilometrico-el-martinillo-segunda-parte"
"Mártir antes de nacer, San Mamés, El","https://etso.es/informes/analisis-estilometrico-el-martir-antes-de-nacer-san-mames"
"Mártir del Sacramento, El","https://etso.es/informes/analisis-estilometrico-el-martir-del-sacramento"
"Mártir valiente en Roma, San Jorge, El","https://etso.es/informes/analisis-estilometrico-el-martir-valiente-en-roma-san-jorge"
"Mártir y rey de Sevilla San Hermenegildo","https://etso.es/informes/analisis-estilometrico-martir-y-rey-de-sevilla-san-hermenegildo"
"Mártires de Córdoba, Los","https://etso.es/informes/analisis-estilometrico-los-martires-de-cordoba"
"Mártires de Japón, Los","https://etso.es/informes/analisis-estilometrico-los-martires-de-japon"
"Mártires de Madrid, Los","https://etso.es/informes/analisis-estilometrico-los-martires-de-madrid"
"Mártires de Madrid, Los","https://etso.es/informes/analisis-estilometrico-los-martires-de-madrid-0"
"Mártires de Toledo y tejedor Palomeque","https://etso.es/informes/analisis-estilometrico-martires-de-toledo-y-tejedor-palomeque"
"Mártires de Valencia, Los","https://etso.es/informes/analisis-estilometrico-los-martires-de-valencia"
"Martirio de San Lorencio, El","https://etso.es/informes/analisis-estilometrico-el-martirio-de-san-lorencio"
"Martirio de Santa Lucía, El","https://etso.es/informes/analisis-estilometrico-el-martirio-de-santa-lucia"
"Más amada de Cristo, Santa Gertrudis la Magna, La (Segunda parte)","https://etso.es/informes/analisis-estilometrico-la-mas-amada-de-cristo-santa-gertrudis-la-magna-segunda-parte"
"Más constante mujer","https://etso.es/informes/analisis-estilometrico-mas-constante-mujer"
"Más constante mujer, La (Burlesca)","https://etso.es/informes/analisis-estilometrico-la-mas-constante-mujer-burlesca"
"Más dichosa venganza, La","https://etso.es/informes/analisis-estilometrico-la-mas-dichosa-venganza"
"Más dichoso portal, El","https://etso.es/informes/analisis-estilometrico-el-mas-dichoso-portal"
"Más dichoso prodigio","https://etso.es/informes/analisis-estilometrico-mas-dichoso-prodigio"
"Mas encanto es la hermosura","https://etso.es/informes/analisis-estilometrico-mas-encanto-es-la-hermosura"
"Más es el ruido que las nueces y el reloj toque su hora","https://etso.es/informes/analisis-estilometrico-mas-es-el-ruido-que-las-nueces-y-el-reloj-toque-su-hora"
"Más es querer que poder","https://etso.es/informes/analisis-estilometrico-mas-es-querer-que-poder"
"Más feliz cautiverio y los sueños de Josef, El","https://etso.es/informes/analisis-estilometrico-el-mas-feliz-cautiverio-y-los-suenos-de-josef"
"Más galán portugués, Duque de Berganza, El","https://etso.es/informes/analisis-estilometrico-el-mas-galan-portugues-duque-de-berganza"
"Más hermosa Raquel, pastora de las almas","https://etso.es/informes/analisis-estilometrico-mas-hermosa-raquel-pastora-de-las-almas"
"Más heroica fineza y fortuna de Isabela, La","https://etso.es/informes/analisis-estilometrico-la-mas-heroica-fineza-y-fortuna-de-isabela"
"Más heroico silencio, El","https://etso.es/informes/analisis-estilometrico-el-mas-heroico-silencio"
"Más hidalga hermosura, La","https://etso.es/informes/analisis-estilometrico-la-mas-hidalga-hermosura"
"Más ilustre francés San Bernardo, El","https://etso.es/informes/analisis-estilometrico-el-mas-ilustre-frances-san-bernardo"
"Más ilustre fregona, La","https://etso.es/informes/analisis-estilometrico-la-mas-ilustre-fregona"
"Más impropio verdugo por la más justa venganza, El","https://etso.es/informes/analisis-estilometrico-el-mas-impropio-verdugo-por-la-mas-justa-venganza"
"Más justo rey de Grecia","https://etso.es/informes/analisis-estilometrico-mas-justo-rey-de-grecia"
"Más la amistad que la sangre","https://etso.es/informes/analisis-estilometrico-mas-la-amistad-que-la-sangre"
"Más merece quien más ama","https://etso.es/informes/analisis-estilometrico-mas-merece-quien-mas-ama"
"Más pesa el rey que la sangre - Honor de los Guzmanes y defensa de Tarifa, El","https://etso.es/informes/analisis-estilometrico-mas-pesa-el-rey-que-la-sangre-el-honor-de-los-guzmanes-y-defensa-de"
"Más pesan pajas que culpas","https://etso.es/informes/analisis-estilometrico-mas-pesan-pajas-que-culpas"
"Más piadoso troyano, El","https://etso.es/informes/analisis-estilometrico-el-mas-piadoso-troyano"
"Más puede amor, que dolor","https://etso.es/informes/analisis-estilometrico-mas-puede-amor-que-dolor"
"Más pueden celos que amor","https://etso.es/informes/analisis-estilometrico-mas-pueden-celos-que-amor"
"Más temido andaluz y guapo Francisco Esteban","https://etso.es/informes/analisis-estilometrico-mas-temido-andaluz-y-guapo-francisco-esteban"
"Más triunfa el amor rendido","https://etso.es/informes/analisis-estilometrico-mas-triunfa-el-amor-rendido"
"Más vale a quien Dios ayuda, Esaú y Jacob, o el Pastor más perseguido y finezas de Raquel","https://etso.es/informes/analisis-estilometrico-mas-vale-quien-dios-ayuda-esau-y-jacob-el-pastor-mas-perseguido-y"
"Más vale el hombre que el nombre","https://etso.es/informes/analisis-estilometrico-mas-vale-el-hombre-que-el-nombre"
"Más vale maña que fuerza","https://etso.es/informes/analisis-estilometrico-mas-vale-mana-que-fuerza"
"Más vale salto de mata que ruego de buenos","https://etso.es/informes/analisis-estilometrico-mas-vale-salto-de-mata-que-ruego-de-buenos"
"Más vale tarde que nunca","https://etso.es/informes/analisis-estilometrico-mas-vale-tarde-que-nunca"
"Más valéis vos, Antona, que la corte toda","https://etso.es/informes/analisis-estilometrico-mas-valeis-vos-antona-que-la-corte-toda"
"Más valiente andaluz, Antón Bravo, El","https://etso.es/informes/analisis-estilometrico-el-mas-valiente-andaluz-anton-bravo"
"Más valiera callarlo que no decirlo","https://etso.es/informes/analisis-estilometrico-mas-valiera-callarlo-que-no-decirlo"
"Más verdadera copia del mejor original, La","https://etso.es/informes/analisis-estilometrico-la-mas-verdadera-copia-del-mejor-original"
"Matar por celos su dama","https://etso.es/informes/analisis-estilometrico-matar-por-celos-su-dama"
"Mateo Vizconde","https://etso.es/informes/analisis-estilometrico-mateo-vizconde"
"Maya, La","https://etso.es/informes/analisis-estilometrico-la-maya-0"
"Maya, La","https://etso.es/informes/analisis-estilometrico-la-maya"
"Mayor constancia de Muzio Scebola, La","https://etso.es/informes/analisis-estilometrico-la-mayor-constancia-de-muzio-scebola"
"Mayor corona, La","https://etso.es/informes/analisis-estilometrico-la-mayor-corona"
"Mayor de los milagros por premio de un santo celo y santos corporales de Daroca, El","https://etso.es/informes/analisis-estilometrico-el-mayor-de-los-milagros-por-premio-de-un-santo-celo-y-santos"
"Mayor desengaño, El","https://etso.es/informes/analisis-estilometrico-el-mayor-desengano"
"Mayor desgracia de Carlos Quinto y jornada de Argel, La","https://etso.es/informes/analisis-estilometrico-la-mayor-desgracia-de-carlos-quinto-y-jornada-de-argel"
"Mayor dicha en amor, y Glorias del Rey Fernando, La","https://etso.es/informes/analisis-estilometrico-la-mayor-dicha-en-amor-y-glorias-del-rey-fernando"
"Mayor dicha en el monte, La","https://etso.es/informes/analisis-estilometrico-la-mayor-dicha-en-el-monte"
"Mayor encanto, amor, El","https://etso.es/informes/analisis-estilometrico-mayor-encanto-amor-el"
"Mayor hazaña de Alejandro Magno, La","https://etso.es/informes/analisis-estilometrico-la-mayor-hazana-de-alejandro-magno"
"Mayor hazaña de Carlos V, La - Mayor hazaña del emperador Carlos V, La","https://etso.es/informes/analisis-estilometrico-la-mayor-hazana-de-carlos-v-la-mayor-hazana-del-emperador-carlos-v"
"Mayor hazaña de Portugal, La","https://etso.es/informes/analisis-estilometrico-la-mayor-hazana-de-portugal"
"Mayor imposible, El","https://etso.es/informes/analisis-estilometrico-el-mayor-imposible"
"Mayor mágico el diablo, El","https://etso.es/informes/analisis-estilometrico-el-mayor-magico-el-diablo"
"Mayor monstruo del mundo, El","https://etso.es/informes/analisis-estilometrico-mayor-monstruo-del-mundo-el"
"Mayor prodigio y purgatorio en la vida, El","https://etso.es/informes/analisis-estilometrico-el-mayor-prodigio-y-purgatorio-en-la-vida"
"Mayor rey de los reyes, El","https://etso.es/informes/analisis-estilometrico-el-mayor-rey-de-los-reyes"
"Mayor soberbia humana de Nabucodonosor, La","https://etso.es/informes/analisis-estilometrico-la-mayor-soberbia-humana-de-nabucodonosor"
"Mayor trance de honor, El","https://etso.es/informes/analisis-estilometrico-el-mayor-trance-de-honor"
"Mayor triunfo de Julio César y batalla de Farsalia, El","https://etso.es/informes/analisis-estilometrico-el-mayor-triunfo-de-julio-cesar-y-batalla-de-farsalia"
"Mayor triunfo en sí mismo, El","https://etso.es/informes/analisis-estilometrico-el-mayor-triunfo-en-si-mismo"
"Mayor victoria de Constantino, La","https://etso.es/informes/analisis-estilometrico-la-mayor-victoria-de-constantino"
"Mayor victoria, La","https://etso.es/informes/analisis-estilometrico-la-mayor-victoria"
"Mayor virtud de un rey, La","https://etso.es/informes/analisis-estilometrico-la-mayor-virtud-de-un-rey"
"Mayorazgo del cielo, El","https://etso.es/informes/analisis-estilometrico-el-mayorazgo-del-cielo"
"Mayorazgo dudoso, El","https://etso.es/informes/analisis-estilometrico-el-mayorazgo-dudoso"
"Mayorazgo figura, El","https://etso.es/informes/analisis-estilometrico-el-mayorazgo-figura"
"Mayordomo de Dios y devoción de las ánimas, El","https://etso.es/informes/analisis-estilometrico-el-mayordomo-de-dios-y-devocion-de-las-animas"
"Mayordomo de la duquesa Amalfi, El","https://etso.es/informes/analisis-estilometrico-el-mayordomo-de-la-duquesa-amalfi"
"Mazariegos y Monsalves","https://etso.es/informes/analisis-estilometrico-mazariegos-y-monsalves"
"Médico de su amor, El","https://etso.es/informes/analisis-estilometrico-el-medico-de-su-amor"
"Médico de su honra, El","https://etso.es/informes/analisis-estilometrico-el-medico-de-su-honra"
"Médico de su honra, El - Celoso de su honra, El","https://etso.es/informes/analisis-estilometrico-el-medico-de-su-honra-el-celoso-de-su-honra"
"Médico pintor San Lucas, El (Impreso 1675)","https://etso.es/informes/analisis-estilometrico-el-medico-pintor-san-lucas-impreso-1675"
"Médico pintor San Lucas, El (Manuscrito)","https://etso.es/informes/analisis-estilometrico-el-medico-pintor-san-lucas-manuscrito"
"Médicos divinos y luceros de la Iglesia, San Cosme y San Damián, Los","https://etso.es/informes/analisis-estilometrico-los-medicos-divinos-y-luceros-de-la-iglesia-san-cosme-y-san-damian"
"Mejor alcalde, el rey, El","https://etso.es/informes/analisis-estilometrico-el-mejor-alcalde-el-rey"
"Mejor alcalde, el rey, El","https://etso.es/informes/analisis-estilometrico-el-mejor-alcalde-el-rey-0"
"Mejor amigo, el muerto y el capuchino escocés, El","https://etso.es/informes/analisis-estilometrico-el-mejor-amigo-el-muerto-y-el-capuchino-escoces"
"Mejor amigo, el muerto y fortunas de don Juan de Castro, El (Versión impresos)","https://etso.es/informes/analisis-estilometrico-el-mejor-amigo-el-muerto-y-fortunas-de-don-juan-de-castro-version-0"
"Mejor amigo, el muerto y fortunas de don Juan de Castro, El (Versión manuscritos)","https://etso.es/informes/analisis-estilometrico-el-mejor-amigo-el-muerto-y-fortunas-de-don-juan-de-castro-version"
"Mejor amigo, el rey, El","https://etso.es/informes/analisis-estilometrico-el-mejor-amigo-el-rey"
"Mejor enamorada, la Magdalena, La","https://etso.es/informes/analisis-estilometrico-la-mejor-enamorada-la-magdalena"
"Mejor espigadera, La","https://etso.es/informes/analisis-estilometrico-la-mejor-espigadera"
"Mejor esposo, El","https://etso.es/informes/analisis-estilometrico-el-mejor-esposo"
"Mejor esposo, El","https://etso.es/informes/analisis-estilometrico-el-mejor-esposo-0"
"Mejor está que estaba","https://etso.es/informes/analisis-estilometrico-mejor-esta-que-estaba"
"Mejor flor de Sicilia, Santa Rosolea","https://etso.es/informes/analisis-estilometrico-mejor-flor-de-sicilia-santa-rosolea"
"Mejor fruto del roble, El","https://etso.es/informes/analisis-estilometrico-el-mejor-fruto-del-roble"
"Mejor hijo de Madrid, El","https://etso.es/informes/analisis-estilometrico-el-mejor-hijo-de-madrid"
"Mejor luna africana, La","https://etso.es/informes/analisis-estilometrico-la-mejor-luna-africana"
"Mejor luz de la Italia, La","https://etso.es/informes/analisis-estilometrico-la-mejor-luz-de-la-italia"
"Mejor luz de Sevilla, Nuestra Señora de los Reyes, La","https://etso.es/informes/analisis-estilometrico-la-mejor-luz-de-sevilla-nuestra-senora-de-los-reyes"
"Mejor maestro amor, El","https://etso.es/informes/analisis-estilometrico-el-mejor-maestro-amor"
"Mejor maestro, el tiempo, El","https://etso.es/informes/analisis-estilometrico-el-mejor-maestro-el-tiempo"
"Mejor mozo de España, El","https://etso.es/informes/analisis-estilometrico-el-mejor-mozo-de-espana"
"Mejor padre de pobres, El","https://etso.es/informes/analisis-estilometrico-el-mejor-padre-de-pobres"
"Mejor padre de pobres, El","https://etso.es/informes/analisis-estilometrico-el-mejor-padre-de-pobres-0"
"Mejor par de los doce, El","https://etso.es/informes/analisis-estilometrico-el-mejor-par-de-los-doce"
"Mejor representante San Ginés, El","https://etso.es/informes/analisis-estilometrico-el-mejor-representante-san-gines"
"Mejor rey de Borgoña, El","https://etso.es/informes/analisis-estilometrico-el-mejor-rey-de-borgona"
"Mejor rey de los reyes","https://etso.es/informes/analisis-estilometrico-mejor-rey-de-los-reyes"
"Mejor rey del mundo, y templo de Salomón, El","https://etso.es/informes/analisis-estilometrico-el-mejor-rey-del-mundo-y-templo-de-salomon"
"Mejor rey en rehenes, El","https://etso.es/informes/analisis-estilometrico-el-mejor-rey-en-rehenes"
"Mejor testigo es Dios, El","https://etso.es/informes/analisis-estilometrico-el-mejor-testigo-es-dios"
"Mejor tutor es Dios, El","https://etso.es/informes/analisis-estilometrico-el-mejor-tutor-es-dios"
"Mejores peregrinos y Jerusalén sitiada, Los","https://etso.es/informes/analisis-estilometrico-los-mejores-peregrinos-y-jerusalen-sitiada"
"Melancólico, El","https://etso.es/informes/analisis-estilometrico-el-melancolico"
"Melindres de Belisa, Los","https://etso.es/informes/analisis-estilometrico-los-melindres-de-belisa"
"Melisendra","https://etso.es/informes/analisis-estilometrico-melisendra"
"Mentir por razón de estado","https://etso.es/informes/analisis-estilometrico-mentir-por-razon-de-estado"
"Mentir y mudarse a un tiempo","https://etso.es/informes/analisis-estilometrico-mentir-y-mudarse-un-tiempo"
"Mercader amante, El","https://etso.es/informes/analisis-estilometrico-el-mercader-amante"
"Mercader de Toledo, vara de medir, y acción del mejor testigo, El - Mejor testigo, El","https://etso.es/informes/analisis-estilometrico-el-mejor-testigo-el-mercader-de-toledo-vara-de-medir-y-accion-del"
"Merecer de la Fortuna","https://etso.es/informes/analisis-estilometrico-merecer-de-la-fortuna"
"Mérito en la templanza y ventura por el sueño, El","https://etso.es/informes/analisis-estilometrico-el-merito-en-la-templanza-y-ventura-por-el-sueno"
"Mérito es la corona, El","https://etso.es/informes/analisis-estilometrico-el-merito-es-la-corona"
"Mesa redonda, La","https://etso.es/informes/analisis-estilometrico-la-mesa-redonda"
"Mesas de la fortuna, Las","https://etso.es/informes/analisis-estilometrico-las-mesas-de-la-fortuna"
"Mesías verdadero, auto al nacimiento de Cristo Señor, El","https://etso.es/informes/analisis-estilometrico-el-mesias-verdadero-auto-al-nacimiento-de-cristo-senor"
"Mesón de la corte, El","https://etso.es/informes/analisis-estilometrico-el-meson-de-la-corte"
"Mesonera del cielo, La","https://etso.es/informes/analisis-estilometrico-la-mesonera-del-cielo"
"Mientras yo podo las viñas","https://etso.es/informes/analisis-estilometrico-mientras-yo-podo-las-vinas"
"Milagro por los celos, El","https://etso.es/informes/analisis-estilometrico-el-milagro-por-los-celos"
"Milagros del serafin","https://etso.es/informes/analisis-estilometrico-milagros-del-serafin"
"Milagrosa elección de San Pío Quinto, La","https://etso.es/informes/analisis-estilometrico-la-milagrosa-eleccion-de-san-pio-quinto"
"Milagroso imposible y Santa Rita de Casia, El","https://etso.es/informes/analisis-estilometrico-el-milagroso-imposible-y-santa-rita-de-casia"
